file_path,title,description,link,alt_text,section_id,note
images/pin25.png,2026 Planner Inspiration from the USVI,Using my 2026 planner in St John reminded me that planning is enhanced by travel. Observing the USVI’s rhythms shaped my reflections and allowed me to approach goals with calm intention and clarity.,https://www.loveofsalt.com,Planner with scenic tropical backdrop,,Combine planning and travel insights
images/pin26.png,Karma Beach Lounge in the Golden Hour,"Karma Beach Lounge during the golden hour in St John captures the magic of light, place, and reflection. The USVI feels familiar yet alive with subtle differences, embodying the 2026 aesthetic I try to capture in my life and my photography.",https://www.loveofsalt.com,Golden hour view of beach lounge and coastline,,Highlight magical light and reflective moments
images/pin27.png,Observing St John’s Hidden Gems,"My last walks through St John revealed hidden gems of the USVI, quiet corners that inspire vacation photo ideas. These small discoveries are reminders of how travel teaches attention and reflection, central to a 2026 aesthetic.",https://www.loveofsalt.com,Cozy secluded St John corner with sunlight peeking through foliage,,Encourage noticing small travel details
images/pin28.png,Evening Reflections at Karma Beach Lounge,"Evening at Karma Beach Lounge brings stillness to St John. Observing the water, light, and distant hills in the USVI reinforces the reflective side of a 2026 aesthetic, where observation matters as much as experience.",https://www.loveofsalt.com,Evening sea view with beach lounge seating,,Emphasize reflective and quiet evening moments
images/pin29.png,Planning 2026 With Island Calm,"Writing in my 2026 planner while surrounded by St John’s calm allowed me to connect travel experience with intention. The USVI’s rhythm gently guided my reflections, showing how travel and planning can coexist beautifully.",https://www.loveofsalt.com,Planner with coastal backdrop and gentle sunlight,,Blend planning practice with travel-inspired calm
